"institution","collection","recordsets","recordsetQuery","institution_code","collection_code","collection_uuid","collection_lsid","collection_url","collection_catalog_url","description","descriptionForSpecialists","cataloguedSpecimens","knownToContainTypes","taxonCoverage","geographic_range","collectionExtent","contact","contact_role","contact_email","mailing_address","mailing_city","mailing_state","mailing_zip","physical_address","physical_city","physical_state","physical_zip","UniqueNameUUID","attributionLogoURL","providerManagedID","derivedFrom","sameAs","flags","portalDisplay","lat","lon","count","type"
"Broward College","Entomology","f4666aa7-93f0-41f7-83c2-497af7a06887","{""recordset"":""f4666aa7-93f0-41f7-83c2-497af7a06887""}","BROW","BRIC","urn:uuid:6f1612ca-fdde-4111-8a4e-16f82ecdeb9d","","","","","",NA,NA,"","","","David Serrano","","dserrano@broward.edu","","","","","","Davie","Florida","","urn:uuid:d8ac5bd2-ec85-4a90-ba6b-7eb7a2043313","","","","","","",26.0791,-80.2362,1013,"arthropoda"
"Natural History Museum of Los Angeles County","Invertebrate Paleontology","5082e6c8-8f5b-4bf6-a930-e3e6de7bf6fb","{""recordset"":""5082e6c8-8f5b-4bf6-a930-e3e6de7bf6fb""}","LACM","LACMIP","urn:uuid:3d086afe-1145-4aaf-a0c1-aab5d83a8c38","","http://www.nhm.org/site/research-collections/invertebrate-paleontology","http://ip.nhm.org/ipdatabase/lot_show","Comprehensive for marine invertebrate phyla for the Phanerozoic, but with strengths in Mollusca, Scleractinia, Decapoda and Cirripedia. Global, with a concentration in the eastern Pacific (Alaska-Peru) and in particular California, Baja California, Baja California Sur, and Nevada.","",1800000,TRUE,"Mollusca","Global, with a concentration in the eastern Pacific (Alaska-Peru) and in particular California, Baja California, Baja California Sur, and Nevada.","7000000","Austin Hendy","Collections Manager","ahendy@nhm.org","900 Exposition Boulevard","Los Angeles","California","90007","900 Exposition Boulevard","Los Angeles","California","90007","urn:uuid:4c545642-5064-44c1-bb31-7a5ccc1674a3","","","","","","",34.0181,-118.289,1001,"arthropoda"
"University of Missouri, W.R. Enns Entomology Museum","Entomology","81dc7cdb-66be-4683-ae79-068a784378b1","{""recordset"":""81dc7cdb-66be-4683-ae79-068a784378b1""}","UMOC","Insect Collection","urn:uuid:18316d5a-964f-4030-bdc1-e5b7886f28c8","","http://museum.insecta.missouri.edu/","","Lepidoptera, Coleoptera, Heteroptera Global","",NA,NA,"Lepidoptera, Coleoptera, Heteroptera","Global","","Robert Sites","Director","sitesr@missouri.edu","MU Plant Sciences, 52 Agriculture Lab","Columbia","Missouri","65211","52 Agriculture Lab","Columbia","Missouri","65211","urn:uuid:7421fcdb-22a9-4a46-a282-462673f1da9d","","","","","","",39.172,-91.8734,832,"arthropoda"
"Denver Botanic Gardens","Arthropods","0395f3c4-0277-43b6-a36d-e07720588790","{""recordset"":""0395f3c4-0277-43b6-a36d-e07720588790""}","DBG","DBGA","urn:uuid:3a782842-fe3a-11e4-ac7a-002315492bbc","http://grbio.org/cool/vnsv-68mw","","http://symbiota4.acis.ufl.edu/scan/portal/collections/misc/collprofiles.php?collid=57","","",NA,NA,"","","","Richard Allman Levy","Database Associate","richard.levy@botanicgardens.org","909 York Street","Denver","Colorado","80206","1007 York Street","Denver","Colorado","80206-3799","urn:uuid:e6c11c15-8861-47bb-8f5a-5fed3a49a07c","","","","","","",39.7328,-104.9599,733,"arthropoda"
"Western Washington University","Entomology","34cad268-8226-4280-b637-dde38c82a29e","{""recordset"":""34cad268-8226-4280-b637-dde38c82a29e""}","WWU","WWUC","urn:uuid:25b61b24-2718-4b56-97cb-d221364d07b3","http://grbio.org/cool/6jjn-5zws","http://pnwmoths.biol.wwu.edu","","Our geographic area of focus is the northwestern portion of the contiguous United States.","",NA,NA,"","Our geographic area of focus is the northwestern portion of the contiguous United States.","","Merrill Peterson","","peterson@biol.wwu.edu","","","","","516 High Street - MS-9160","Bellingham","WA","98225-9160","urn:uuid:5555d853-7ab1-4a19-b3da-a4e0c28b7520","","","","","","",48.7382,-122.4849,656,"arthropoda"
"Kutztown University, Gregory P. Setfill Collection","Entomology","d767f759-af64-4464-8614-c77ca44cad8d","{""recordset"":""d767f759-af64-4464-8614-c77ca44cad8d""}","GPSC","","urn:uuid:26c126f5-1731-43b4-b585-d80216a6ef0c","","http://www2.kutztown.edu/biology","","","",NA,NA,"","","","Gregory Setfill","Curator","setliff@kutztown.edu","Kutztown University, Department of Biology, 227 Boehm Science Building, PO Box 730","Kutztown","Pennsylvania","19530","Kutztown University, Department of Biology, 227 Boehm Science Building, PO Box 730","Kutztown","Pennsylvania","19530","urn:uuid:c0242660-0490-494a-8caf-04c1767250cf","","","","","","",40.5798,-75.7282,577,"arthropoda"
"University of Texas at El Paso Biodiversity Collections","Entomology","b764863c-de93-4d7c-b0cf-1bb57166141d","{""recordset"":""b764863c-de93-4d7c-b0cf-1bb57166141d""}","UTEP","Ento","urn:uuid:baac3ae8-c451-472b-b352-42ea82746c58","","https://www.utep.edu/biodiversity/","http://arctos.database.museum/home.cfm#UTEP","The University of Texas at El Paso Biodiversity Collections Entomology collection includes The Mackay Laboratory of Myrmecology which is overseen by William P. Mackay and has a mission to advance the understanding of ants through research on their taxonomy, systematics and ecology as well as a variety of other insects and arthropods.","",516,NA,"","","","William Mackay","Curator","wmackay@utep.edu","500 West University Avenue, Biology B222","El Paso","Texas","79968","500 West University Avenue, Biology B222","El Paso","Texas","79968","","","","","","","",31.77,-106.5054,516,"arthropoda"
"Wichita State University Biodiversity Laboratory","Entomology","e9607b87-6dcb-4ffa-a4bf-d17ac197ca70","{""recordset"":""e9607b87-6dcb-4ffa-a4bf-d17ac197ca70""}","WICH","WICHI","urn:uuid:08022e0b-b6c0-494e-a301-fe76c2143b91","","","","","",NA,NA,"","","","Mary Liz Jameson","","MaryLiz.Jameson@gmail.com","512 Hubbard Hall","Wichita","Kansas","67260","512 Hubbard Hall","Wichita","Kansas","67260","urn:uuid:5948c340-c83a-4160-99d7-1e12ce5c8564","","","","","","",37.7194,-97.2929,440,"arthropoda"
"Utah Department of Agriculture and Food","Entomology","9bd4ff72-1cb2-431f-bf7b-b5d47e08cc02","{""recordset"":""9bd4ff72-1cb2-431f-bf7b-b5d47e08cc02""}","UDAF","","urn:uuid:fceb1ee2-dcbc-11e4-ae1c-002315492bbc","","ag.utah.gov/","","","",NA,NA,"","","","Joey Caputo","","jcaputo@utah.gov","350 N Redwood Rd","Salt Lake City","Utah","84116","350 N Redwood Rd","Salt Lake City","Utah","84116","urn:uuid:9036106e-f751-4fc6-92ce-39a053650f33","","","","","","",40.7772,-111.9393,425,"arthropoda"
"Bureau of Land Management, Mother Lode Field Office","Bees","0df55e93-0fce-4ba6-a344-1d9918b60816","{""recordset"":""0df55e93-0fce-4ba6-a344-1d9918b60816""}","BLM","MLFO","urn:uuid:bc958340-a6c0-4980-b898-4c814bfd7afe","","","","","",NA,NA,"","","","Landon Eldredge","","leldredge@blm.gov","5152 Hillsdale Cir","El Dorado Hills","California","95762","5152 Hillsdale Cir","El Dorado Hills","California","95762","urn:uuid:103dc587-6e30-4b56-a680-ddd01f760b60","","","","","","",38.6204,-121.0608,233,"arthropoda"
"California State University East Bay Natural History Museum","Entomology","6acaebd6-e8d2-454a-8f50-e7a6734b8c79","{""recordset"":""6acaebd6-e8d2-454a-8f50-e7a6734b8c79""}","CSUEB","CSUEBNHM","urn:uuid:7bf1eb60-183d-448b-8d2e-bc769f31c622","","","","","",NA,FALSE,"","","","Nazzy Pakpour","","Nazzy.pakpour@csueastbay.edu","25800 Carlos Bee Blvd","Hayward","California","94542","25800 Carlos Bee Blvd","Hayward","California","94542","urn:uuid:211b6608-ca61-4af0-a324-a4c5f98ab963","","","","","","",37.6563,-122.0589,152,"arthropoda"
"Iowa State University","Insects","d3412433-4df9-4828-89e0-73956898f749","{""recordset"":""d3412433-4df9-4828-89e0-73956898f749""}","ISUI","Insect Collection","urn:uuid:ae58c6ed-022f-4e47-ae7c-d26aea30ddd6","","","","","",NA,NA,"","","","Greg W. Courtney","Curator","gwcourt@iastate.edu","2310 Pammel Drive, 339 Science Hall II","Ames","Iowa","50011","2310 Pammel Drive","Ames","Iowa","50011","urn:uuid:60c390ff-96ec-4703-9f22-fc21cdf9fc39","","","","","","",42.0266,-93.6465,140,"arthropoda"
"University of Wisconsin, Insect Research Collection","Entomology","b761d317-a36e-4a05-a5f4-bd3e3963daf6","{""recordset"":""b761d317-a36e-4a05-a5f4-bd3e3963daf6""}","WISC","WIRC","urn:uuid:21672781-fef6-49e9-9c98-5843cb6e6e5e","","http://labs.russell.wisc.edu/wirc/","http://labs.russell.wisc.edu/wirc/collections/","Hemiptera (Membracidae), Coleoptera (generally), Hymenoptera (generally), Diptera (especially Syrphidae), Lepidoptera (generally), WI aquatic insects World, but emphasis on United States, and especially Wisconsin and the Great Lakes Region","",NA,NA,"Hemiptera (Membracidae), Coleoptera (generally), Hymenoptera (generally), Diptera (especially Syrphidae), Lepidoptera (generally), WI aquatic insects","World, but emphasis on United States, and especially Wisconsin and the Great Lakes Region","","Daniel K. Young","Director","young@entomology.wisc.edu","445 Russell Lab, 1630 Liden Drive","Madison","Wisconsin","53706-1598","445 Russell Lab, 1630 Liden Drive","Madison","Wisconsin","53706-1598","urn:uuid:863a8746-d0c0-4f63-8ea4-1101e28a9fa6","","","","","","",43.0852,-89.3777,44,"arthropoda"
"University of Wisconsin-Oshkosh","Insects","1d14acd1-20ef-4a55-8206-f04c8a75ea3e","{""recordset"":""1d14acd1-20ef-4a55-8206-f04c8a75ea3e""}","UWO","UWOIC","urn:uuid:5002ccae-0483-11e5-b0ee-002315492bbc","http://www.uwosh.edu/biology/department-facilities/insect-collection-and-museum-1","","","The collection consists of approximately 200,000 specimens. All pinned or pointed specimens are stored in 21 Cornell or U.S. National Museum (12 drawers each) insect cabinets. Three of these cabinets contains study specimens of all major orders and families of insects and are directly accessible by students for study and reference purposes. In addition, five vial cabinets (10 drawers each) are for storage of specimens preserved in alcohol.. The collection also has approximately 1200 microscope slides that have been purchased commercially, prepared by students or the result of research projects. Total numbers of pinned or pointed specimens for major groups of insects in the collection are: Coleoptera 7025; Lepidoptera 3293; Diptera 2754; Hymenoptera 2533; Hemiptera 2615; Orthoptera 771; and Odonata 394. Some adults of these and other Orders are preserved in alcohol.  There are approximately 10,000 vials with alcohol-preserved adult and immature specimens. Most of these vials have multiple specimens and no attempt has been made to count each specimen. Many of the alcohol-preserved specimens are aquatic immature insects. There are several thousand specimens of Chironomidae larvae resulting from a multiple-year study of chironomid populations in Lake Winnebago and the feeding habits of lake sturgeon. The collection also includes approximately 9,000 Australian specimens most of which are aquatic species, especially Trichoptera larvae (3,922 specimens), all of which are identified to family and many to species. Essentially all specimens have appropriate collection data labels. Many of the specimens were donated by students enrolled in the entomology classes. Most of these are local, regional or state specimens. However, specimens have been collected throughout the U.S. In 2011 the UWOIC became a part of a regional (22 midwestern collections) digitization effort (Invertnet) funded by NSF’s Advancing Digitization of Biological Collections. Currently about 5,000 specimens have been digitized for this on-going project.","",200000,NA,"","","200000","Gene Drecktrah","Curator Emeritus","drecktra@uwosh.edu","Department of Biology 800 Algoma Blvd.","Oshkosh","Wisconsin","54901","Halsey 142 921 Elmwood Ave.","Oshkosh","Wisconsin","54901","urn:uuid:8c02bca2-8bdc-4cd5-b25f-3938adc9cf17","","","","","","",44.0233,-88.5476,37,"arthropoda"
"College of the Atlantic, George B. Dorr Museum","Entomology","610c8eb0-f2b9-458c-936e-3efe5e8522ca","{""recordset"":""610c8eb0-f2b9-458c-936e-3efe5e8522ca""}","COA","Insect specimens","urn:uuid:775c950b-a9ef-4923-8a1e-89e49c2acf15","","http://www.coa.edu/dorr-museum-microsite.htm","","","",NA,NA,"","","","Scott Swann","Collections Manager","sswann@coa.edu","105 Eden Street","Bar Harbor","Maine","04609-0000","105 Eden Street","Bar Harbor","Maine","04609-0000","urn:uuid:64ef6dc5-eeb3-40ff-b2d2-80c7a99ebf5c","","","","","","",44.3924,-68.2201,37,"arthropoda"
